Statement,Ruling,Economics (T/F)
Trump's False claim Hillary Clinton wants to raise taxes on African-American businesses 50 percent,False,F
Donald Trump: Clinton's celebrity backers 'aren't very hot anymore',Mostly False,F
Donald Trump offers misleading statistics about Hispanic poverty,Mostly False,F
Reince Priebus' False claim that 80% of Clinton Foundation costs are overhead,False,F
Donald Trump ad says illegal immigrants would be collecting Social Security under Hillary Clinton,Mostly False,T
Clinton surrogate spins Clinton Foundation defense,Mostly False,F
Donald Trump's Mostly False claim that $400 million payment to Iran was 'ransom',Mostly False,F
